topic_id,top_words
0,"batch, harvest, monitor, sow, threads, allocation, scripts, milk, hosts, ram"
1,"supermarsx, renderer, settings, proxy, debug, vendor, ipv6, request, dns, pull"
2,"bararchy, cuda, precision, gpu, kernels, fp16, fp32, gemm, entropy, float32"
3,"jdereg, tests, jsnyder4, compactset, ttlcache, log4j, collection, compactmap, pull, request"
4,"iteration, next, development, prepare, plugin, maven, release, for, runners, multivalve"
5,"noperson83, schedule, location, project, asset, admin, helpdesk, calendar, template, url"
6,"docs, examples, documentation, overview, book, guide, expand, architecture, document, started"
7,"firebase, deployment, authentication, realtime, configuration, streamline, steps, initialization, step, cli"
8,"codex, master, branch, into, merge, 184hps, 0kdeoo, 8sws06, 7urvnk, 4l9ef3"
9,"map, compactmap, keys, caseinsensitivemap, deepequals, multikeymap, set, collections, key, claude"
10,"telegram, bot, makhin, chat, persons, users, subscriptions, exchange, telegramuserid, invalidation"
11,"md, readme, update, identions, agi, describtion, haven, download, repo, found"
12,"makhin, frontend, shared, chore, api, console, backend, rtk, package, regenerate"
13,"photo, makhin, photos, acl, photobank, inline, filter, photolistpage, query, upload"
14,"main, codex, branch, into, gh, merge, as5jlu, 1lzuqn, 22xgzr, 230j99"
15,"date, timezone, zoneddatetime, dateutilities, localdate, zone, iso, time, timestamp, localtime"
16,"dock, dockable, pinned, docking, docksettings, dockables, docks, global, factory, refactored"
17,"jdk, java, jvm, java9, 21, 11, sun, recover, getcpuclass, java21"
18,"triblespace, book, chapter, repository, macro, inventory, procedural, workspace, clarify, preflight"
19,"gang, equipment, member, members, ascension, crime, boss, manage, wanted, rotate"
20,"jwiedeman, migrate, pages, content, seo, continue, page, website, compliance, faq"
21,"feat, cli, nfix, concurrency, ipc, report, settings, matrix, typed, deliverability"
22,"readme, updated, ead, damn, reamde, powermock, god, regarding, further, edit"
23,"nvm, npmrc, unset, incompatible, your, setting, home, has, which, run"
24,"jsonobject, jsonreader, jsonvalue, json, jsonparser, jsonioexception, type, array, encode, moved"
25,"automation, faction, factions, reputation, focus, augmentations, buy, augments, corp, work"
26,"codesmith, mrme, icommand, commands, ohhmm, pull, request, from, merge, 104"
27,"loganrdj, resume, scroll, snap, timeline, background, wordle, toggle, zoom, hero"
28,"services, ram, memory, allocator, chunks, growable, growableallocation, memoryallocator, reserved, allocation"
29,"master, branch, man, conflicts, of, src, directobjectcreation, pointerevents, removemetrowindow, reconcole"
30,"logger, logging, log, logs, logtoolbar, exceptionhandler, secret, 466, announcer, synchronous"
31,"teamever, prettyblock, block, cover, prettyblocks, parallax, image, text, countdown, mobile"
32,"maps, google, scraper, gmaps, worker, orchestrator, scraping, mapmonkey, sitemap, progress"
33,"adrianwedd, bus, rss, insights, tasks, retry, failed, inbox, ci, guidelines"
34,"kpartlow, readercontext, instant, overrides, converter, factories, injectors, removed, asserts, zoneid"
35,"alexanderthclark, ppf, auction, curve, equilibrium, revenue, intersection, quadratic, docstrings, demand"
36,"import, imports, unused, punycode, remove, correct, qualified, meta, slash, clean"
37,"flaky, valgrind, test, fixing, failing, tests, unsafememory2test, bg, 297, give"
38,"origin, remote, tracking, branch, remotes, config2, feature, merge, upstream, ea"
39,"metricshub, v4, 00, checkstyle, parser, deps, intermediate, ast, 05, numeric"
40,"language, translations, translate, preference, languages, piotr, gorczynski, strings, flows, urdu"
41,"wieslawsoltes, dock, danwalmsley, docking, dockable, dockproperties, pinned, floating, panel, collapse"
42,"enum, enums, enumset, dynamicenummap, dynamicenumset, serializing, enumcache, enumsets, dynamicenum, closes"
43,"docs, plt, parsvars, pls, ticks, etc, more, , , "
44,"teamcity, automatic, feature, master, into, merge, from, , , "
45,"wheel, fortune, segment, pointer, angle, segments, spin, teamever, alignment, labels"
46,"go, katago, gtp, gtpclient, moves, board, kataplay, proxy, game, play"
47,"path, esm, preload, renderer, dirname, pathlib, load, paths, partials, regular"
48,"bbuchsbaum, roxygen, robust, rr, implement, sampling, hrf, ar, baseline, frame"
49,"face, identity, makhin, recognition, faces, statuses, facedto, status, editfacedialog, insightface"
50,"timer, terminal, util, bar, commands, timeout, command, timed, clocktimeout, waiting"
51,"resume, scroll, timeline, toggle, scrolling, scaling, anchor, zoom, mobile, smooth"
52,"chronicle, core, release, prepare, plugin, maven, bring, jar, 10, versions"
53,"piotr, gorczynski, secret, prod, regulations, backend, regulation, privacy, scheduled, authentication"
54,"typescript, tsconfig, ts, rewrite, collections, lib, vendored, dir, tsbuildinfo, convert"
55,"yusukepkl, de, atualiza, para, corre, es, implementa, inno, student, pyside6"
56,"readme, md, updated, info, version, changelog, bullet, userguide, 02, references"
57,"wieslawsoltes, recycling, inpc, control, pseudo, parts, refactoring, guide, diagnostics, vnext"
58,"refactoring, refactorings, pact, maintainability, readability, small, gameview, infixes, refactor, improved"
59,"pom, xml, updated, central, snapshot, problems, changelog, artifactid, organized, versions"
60,"makhin, auth, access, admin, claim, jwt, user, claims, profiles, roles"
61,"locator, store, marker, teamever, popup, map, search, mobile, cms, positioning"
62,"arran4, chezmoi, gpg, shell, template, discovery, path, caelestia, urxvt, container"
63,"exponentiation, fraction, exponentiations, multiplyifsimplifiable, multiplication, integer, multival, valuable, ismultiplicationsimplifiable, reciprocal"
64,"skrypt, problemmatic, norender, fix, fixing, cow, oob, topct, crystal, acquisition"
65,"special, stuff, stuffnthings, changes, edits, len, sh, wrong, applefications, somethings"
66,"prettyblock, prettyblocks, cover, block, column, spacing, card, blocks, toc, spacer"
67,"license, copyright, notices, licence, headers, apache, lgpl, 2025, days, licencecheck"
68,"tournaments, tournament, lobby, extended, functionality, rules, match, tournamentresultsactivity, clarity, regulation"
69,"template, templates, asset, mainpanel, documenttemplate, parts, pseudo, project, render, business"
70,"polyfit, unit, tests, school, classification, test, distancetointerface, raspberryskipfact, testdata, baseaffine"
71,"todo, flakytestrunner, bin, adam, fleet, added, optimizer, todos, skills, nuke"
72,"port, ports, allocator, reading, manager, protocol, utility, sentinel, client, clear"
73,"warnings, warning, analys, mise, greeting, related, 364, 335, suppress, refactoring"
74,"null, nullable, isempty, fields, corrected, po, included, datatable, excluded, where"
75,"javadoc, javadocs, phpdoc, scopeconfined, 390, typos, author, beefing, downgraded, daglas"
76,"homepage, carbon, pages, content, layout, page, revamp, testing, demo, sections"
77,"drag, drop, window, dragging, dragbehavior, dragpreviewhelper, tab, offset, grip, preview"
78,"exception, exceptions, unchecked, throws, catch, review, errorhandler, exceptionhandler, throw, clause"
79,"animation, sprite, ball, idle, kick, player, piotr, gorczynski, sprites, during"
80,"sentrysoftware, v3, 00, issue, v4, plus, fixed, snapshot, dollar, unary"
81,"blog, posts, jwiedeman, post, author, images, layout, article, blogpost5, pages"
82,"varargs, classutilities, rfu, claude, noreply, generated, widening, authored, co, constructor"
83,"serialization, deserialization, deserialize, serializers, serialized, serializedstrequal, serializer, collision, deserializing, serializing"
84,"animation, kick, delay, frame, idle, sprite, run, sprites, pulsing, cycles"
85,"props, base, avalonia, update, web, desktop, curvature, aot, netcore, xunit"
86,"dockmanager, cs, dockwindow, dockhelpers, docktoolchrome, dockdebugoverlayextensions, update, dockdebugoverlaymanager, dockdock, dockproperties"
87,"converter, conversions, mapconversions, convert, conversion, instance, moved, supported, db, static"
88,"enrichers, enricher, enrichment, re, applied, already, pipeline, photo, onnx, previewenricher"
89,"hostwindow, hostwindowbase, hostwindowstate, host, cs, window, hostwindows, defaulthostwindowlocator, locators, idockwindow"
90,"discover, services, discovery, subscriptions, daemon, service, launcher, subscription, discoverclient, runoptions"
91,"genericreflection, typeutilities, type, types, getreturntype, generics, typevariable, generic, polymorphic, sqlite3"
92,"dashboard, location, profile, domains, domain, leads, detail, metrics, csv, connect"
93,"avalonia, updated, avares, 11, 10, update, master, use, to, "
94,"error, errors, closedioruntimeexception, 436, impl, diagnose, dosnt, continuity, ilog2, rip"
95,"zshrc, dot, tmpl, zshenv, x86, utc, 64, 2025, zsh, smp"
96,"sidebar, highlighting, jwiedeman, highlight, docs, scroll, navigation, sidebars, styling, labels"
97,"invite, invitation, invites, invitations, waitingactivity, sender, createinvite, busy, discord, friend"
98,"cache, caching, cachemiddleware, storages, purge, async, caches, capacity, hash, cacheduniverse"
99,"factory, metautils, classfactory, newinstance, classforname, factories, accessors, methods, static, injectors"
100,"fmri, lm, fmridesign, vignette, latent, model, hrf, dataset, vignettes, rmd"
101,"slider, slide, carousel, prettyblock, brands, image, mobile, teamever, infinite, slick"
102,"gitignore, gitattributes, git, python, compat, patterns, reports, pycache, kdiff3, externalproject"
103,"dockcontrol, dockablecontrol, cs, xaml, docktoolchrome, canremovedockableconverter, owneristooldockconverter, update, controlrecycling, datacontext"
104,"fusion, sensor, wappalyzer, matcher, sensorfusion, fingerprinting, dataset, fingerprint, recon, bot"
105,"teamever, allowed, notice, ps, workflow, vendor, syntax, isbot, twillouer, unhook"
106,"whois, bulkwhois, bulk, supermarsx, reply, sw, whoiswrapper, modularize, modules, timings"
107,"fixes, fixesfixes, mods, fixups, migrator, programs, acl, few, generation, some"
108,"header, headers, depth, padding, style, head, reseting, preloaders, heads, displayheader"
109,"modal, preview, product, ajax, allowed, modals, reassurance, iframe, js, upload"
110,"aliases, alias, class, cpuclass, clearcaches, classnotfoundexception, scm, tied, converting, preservation"
111,"changelog, unreleased, entries, directing, updates, doc, document, logging, maintainer, critique"
112,"validator, validation, validators, iserror, validations, isunknown, util, validate, relax, attribute"
113,"blob, blobset, blobstore, blobs, compress, metadata, migrator, longstring, rework, schema"
114,"styles, css, colors, color, style, styling, brand, styledproperty, stylekeyoverride, crude"
115,"stattracker, statistics, stats, stat, velocity, averagevelocity, util, percentiles, listeners, worker"
116,"writeoptions, writeoptionsbuilder, writers, write, readoptionsbuilder, they, referenceable, addpermanent, writeimpl, simplification"
117,"curves, demand, supply, tutorial, market, equilibrium, horizontal, nash, curve, notebook"
118,"view, bind, forms, baseform, pump, logic, form, state, edit, introduce"
119,"rebase, branches, push, target, rebased, releases, abort, branch, protection, autostash"
120,"docker, dockerfile, arm64, compose, pipx, container, qemu, env, raspberry, foundationdb"
121,"sidebar, highlight, highlighting, accordion, sidebars, docs, active, toc, style, nav"
122,"fmt, rt, minenextprime, ggg, omnn, gtimes, growprime, metedata, sadf, sdf"
123,"schema, migration, db, frog, blue, migrations, keyspace, schemas, renderdatabase, database"
124,"blog, posts, author, wp, layout, post, getstaticpaths, news, tag, section"
125,"dependency, dependencies, vendored, sanctuary, libraries, packagereference, panandzoom, zlib, tbb, interfacing"
126,"thread, singlethreadedchecked, lawrey, peter, threading, resetting, threads, illegalstateexception, disabling, cleaningthreadlocal"
127,"protocol, util, response, sendmessagereceiveresponse, sendmessage, send, precise, isrequest, baseserver, trysendmessage"
128,"edinsoncs, wallet, balance, transaction, chain, explorer, persistent, storage, transactions, utilities"
129,"macro, macros, crate, hex, entity, pattern, tribles, brace, field, variable"
130,"bozelosp, 46, 55, 41, 38, 39, 47, 43, 42, 48"
131,"comment, comments, commented, review, too, address, withstand, fixme, jshint, extraneous"
132,"shortcode, shortcodes, sales, contact, accessories, rendering, best, hooks, stores, reload"
133,"de, adiciona, atualiza, melhorias, para, alunos, da, suporte, em, testes"
134,"api, apis, endpoints, base, url, tomaps, squared, redudant, inadvertent, 0x"
135,"auth, token, impersonation, ssl, tls, identity, credentials, certificate, authentication, endpoint"
136,"updating, bom, version, 24ea76, 2017, 08, 14, 24ea8, 01t07, 012z"
137,"props, directory, pact, build, work, packages, acs, more, reverts, flutter"
138,"ci, npm, workflow, rolling, node, js, opt, jobs, successful, pipelines"
139,"v3, maven, 00, plugin, release, ipconfig, exec, 01, mvn, prepare"
140,"nickname, moderation, vertex, gorczynski, piotr, checknickname, callable, credential, email, login"
141,"lookbook, markers, zones, pulse, marker, teamever, helper, amplify, adjust, block"
142,"jremillard, overpass, todo, mru, renderdatabase, source, instructions, suppression, note, cleandatasource"
143,"unused, code, removed, dead, remove, codefactor, 2002, abandoned, kb, cpd"
144,"face, emotion, insightface, embeddings, embedding, similarity, pgvector, faces, attributes, distance"
145,"danwalmsley, hendrikmennen, hoijui, elenaddd, antoinetran, drujensen, kaihufenbach, nan, infinity, miticcio"
146,"pile, triblespace, truncation, refresh, abort, garbage, bucket, harness, flush, open"
147,"shortcode, selling, teamever, shortcodes, cross, accessories, sales, products, best, newsletter"
148,"header, styling, jwiedeman, pages, footer, nasa, page, terms, sticky, layout"
149,"cloudbuild, yaml, cloud, destroy, billing, deploy, organization, projects, folder, deployment"
150,"firestore, firebase, gorczynski, piotr, auth, terminate, crash, anonymous, csp, 294"
151,"doctor, analytics, width, linking, table, ga4, full, enhance, preflight, layout"
152,"symfony, doctrine, controller, admin, route, ever, legacy, migrate, le, teamever"
153,"cleanup, cleaning, wipe, decomposition, research, ups, inspection, cleanups, inventory, ce"
154,"jorgesanabria, docblocks, unitofwork, crud, fetchall, developmenterrormiddleware, examples, develop, devlynnx, uow"
155,"gitconfig, dot, tmpl, vimrc, literal, gvimrc, dlv, update, delete, disabled"
156,"mergeor, merged, merging, valuable, params, broken, conflict, three, two, mergeing"
157,"releasing, git, working, issues, out, maven, with, the, , "
158,"cleanup, code, minor, clean, up, fmt, reintroduce, simplifcation, lengthy, copyrights"
159,"doc, updates, docs, minor, document, backlog, needing, repository, docstring, later"
160,"config, setconfig, configs, dataclass, setconfigdefault, getconfig, values, constants, getter, corp"
161,"hero, background, ascii, image, transparent, frog, aspect, sections, ratio, jumbotron"
162,"middleware, jorgesanabria, relation, odata, linq, activerecord, dbal, crud, rx, helpers"
163,"deprecated, methods, rather, todo, un, than, uniformprintstream, onbackpressed, ifnotequal, hash32"
164,"graft, grafting, augs, multipliers, augment, ongoing, queue, presets, prototype, augments"
165,"yml, build, shard, snappy, homebrew, macos, update, dotfiles, v1, brew"
166,"release, prepare, plugin, maven, 1540, 1233, , , , "
167,"fixes, bug, small, minor, cfg, updates, marked, major, flakyness, growinginsert"
168,"bozelosp, 112, 117, 103, 111, 105, 108, 121, 113, 115"
169,"properties, property, redeclaration, rearranged, notimplementedexception, datamember, requiresdatatemplateattribute, relativetoparameter, subject, attr"
170,"disable, hotspots, enabledif, dperformrelease, islinux, enable, disabled, temporary, assumetrue, opened"
171,"tournament, gorczynski, piotr, tournaments, lobby, statistics, rules, match, leave, ranking"
172,"sergmariadb, elaborate, linkdirs, inexistent, omitting, glob, linking, pch, ohhmm, leveldb"
173,"deps, bump, electron, chore, 37, dev, express, supermarsx, chromedriver, 24"
174,"friends, friend, seen, sorting, search, last, addfriendactivity, addfriend, piotr, gorczynski"
175,"hacknet, buy, heap, payback, buying, money, nodes, gain, candidate, upgrade"
176,"dockbase, dockablebase, dockable, factorybase, cs, update, lighthouse, desktop, mobile, base"
177,"mainview, axaml, replaceview, findview, update, , , , , "
178,"arran4, alacritty, hyprland, shortcut, ctrl, keybind, keybinding, autostart, cycling, terminal"
179,"parameter, rflann, args, variables, param, variable, shadowing, unused, var, member"
180,"contracts, contract, compression, lz, cipher, hamming, decompression, encryption, split, hammingcodes"
181,"reactiveui, csproj, reactiveproperty, sample, dock, reactive, routing, unittests, di, reactiveobject"
182,"factorybase, cs, dta, factory, update, events, init, partial, controller, invalid"
183,"yolo, nil, yo, nothinghappenedatall, ified, kull, tibble, bool, big, everything"
184,"readfile, datapump, printstream, handle, stream, readloop, exceptions, pipelines, readding, walkfiletree"
185,"refactor, refactored, refctoring, propose, refector, enrich, marginal, projects, let, revenue"
186,"drag, danwalmsley, dragging, bandysc, window, preview, wieslawsoltes, offset, win32, tabitems"
187,"snapshot, opened, 14, begin, version, updated, krusties, officially, publishes, stared"
188,"handlers, eventhandler, signalhandler, eventloop, handler, handlerpriority, signal, closing, invocation, deprecate"
189,"projects, project, renamed, persisting, reorganized, shifts, kwargs, codegen, bydchain, cedar"
190,"javadoc, javadocs, updated, tidy, sources, 202307, userguide, updates, nearing, jars"
191,"stock, tracker, ticks, backtest, symbols, indicators, tick, lints, indicator, trader"
192,"release, prepare, plugin, maven, 19, 18, 13, 11, 1239, 1251"
193,"benchmark, benchmarks, benchmarking, performance, estiamtes, ed, jhm, rayon, getthefastestresult, ufoids"
194,"facebook, sdk, token, login, piotr, gorczynski, community, client, init, initialization"
195,"medusa, columns, jwiedeman, recon, scan, autolighthouse, scanning, enrichment, integrate, scanner"
196,"ads, ad, consent, admob, frequency, interstitial, piotr, gorczynski, unauthorized, personalized"
197,"formatting, indenting, format, indent, spaces, indentation, indented, delicate, indents, wow"
198,"rollback, release, plugin, maven, of, 1239, 1233, 1251, 1546, 1652"
199,"contracts, contract, fetch, solvers, turn, solve, get, incomplete, print, gained"
200,"dockcontrol, axaml, dockableoptionsview, dockpanelsplitter, rootdock, dockdockcontrol, hyperland, cs, update, note"
201,"23ea, reverting, back, snapshot, bom, version, 22ea, 22ea0, flutter, 64"
202,"ns, idempotent, atexit, proxy, infiltrations, capturing, syntax, ensurecore, mixup, installlogger"
203,"sln, dock, update, , , , , , , "
204,"solver, system, solving, solve, equations, equation, calculationcachedemo, calculatetotalexpression, solutions, formula"
205,"24ea, reverting, back, snapshot, bom, version, 17, to, , "
206,"query, length, dividers, queries, chars, len, span, psql, segmented, sql"
207,"doctor, analytics, jwiedeman, table, faq, width, layout, 1056, 1025, outcomes"
208,"bladeburner, spread, dangerous, action, chaos, actions, success, diplomacy, chance, uncertainty"
209,"simplify, regex, logic, minmax, simplifications, simplified, level, game, easter, 2021"
210,"dns, domain, getdomainsetup, convertdomain, dnsbl, lookup, psl, randomization, cover, lookups"
211,"bootstrap, cracker, foodnstuff, start, bootstrapping, script, slim, larger, scripts, prosaic"
212,"rounding, zeros, nan, decimals, trailing, digits, decimalplaces, infinity, doubles, upper"
213,"debug, overlay, m1, apple, diagnostic, info, debugging, tip, adorned, toggleable"
214,"program, adornerhelper, cs, ifactory, tool, drophelper, simplecommand, analyzeenricher, update, diagnostics"
215,"mrme, codesmith, mandatory, 46, 41, 58, 71, 43, 39, 47"
216,"10, 11, preview5, preview7, preview1, updated, gtkrc, preview4, preview8, rc2"
217,"develop, origin, remote, tracking, branch, into, tribles, macros, codegen, conflicts"
218,"calendar, schedule, event, url, reversing, day, timecard, reversal, views, detail"
219,"namespace, namespaces, homoiconic, literature, transpilation, rework, prefix, namespaced, lifetimes, ids"
220,"boost, libs, openmind, skrypt, linking, boostrap, openjdk, preferred, mac, 193"
221,"version, bump, suffix, versions, increment, 13, modelversion, 15, module, versioncode"
222,"removed, jupiter, bogus, frameworks, temporary, remove, lecture, killing, demo, directory"
223,"hero, ascii, frog, aspect, jwiedeman, ratio, feature43, skill, silos, 1092"
224,"py, urls, init, views, models, update, world, constraints, setup, equilibrium"
225,"invitationsactivity, invitations, recyclerview, invite, gorczynski, piotr, screen, invites, animations, missed"
226,"resource, resources, background, closed, gc, closing, releasependingresources, thread, randomaccessfile, releaser"
227,"abstractcloseable, closeable, isclosed, implementing, standardised, lifecycles, abstractcloseablereferencecounted, throwexceptionifclosed, performclose, performed"
228,"bytes, safepoints, zing, performant, supported, bytebuffer, adding, operations, 209, bytesmarshallable"
229,"travis, monopoly, cwv, update, idea, no, , , , "
230,"clock, countdown, opponent, adding, lost, ends, player, shooting, runs, goal"
231,"chronicle, core, release, prepare, plugin, maven, 23ea34, 23ea33, 22ea31, 22ea30"
232,"feat, auth, profiles, profile, connect, access, expose, management, roles, clientid"
233,"lighthouse, audit, audits, accessibility, phase, seo, auditing, crawler, desktop, jwiedeman"
234,"iam, grant, cloud, policy, role, binding, account, identity, step, enabling"
235,"roas, calculator, profit, mdx, calculators, syntax, jwiedeman, cumulative, 1122, 1132"
236,"picker, color, jremillard, dialog, icon, hex, transparency, table, persistent, redner"
237,"cloud, configuration, trigger, jq, build, reliability, triggers, registration, substitution, google"
238,"avaloniademo, csproj, avaloniamodelpolymorphictyperesolver, avaloniadockserializer, assemblyinfo, cedarsoftware, repackaged, cs, avalonialistjsonconverter, web"
239,"variables, confusing, rename, variable, renamed, names, swc, terminology, clarity, smallstring"
240,"nickname, logout, login, showing, after, email, label, prompt, loginwithprovider, editnickname"
241,"eslint, directory, errors, ossar, config, dep, tseslint, ehlo, instruction, starttls"
242,"json, package, customjsonsubobjectstest, global, locked, appsettings, lock, jsonc, launchsettings, customheader"
243,"xml, pom, mining, pos, roots, standardize, distributionmanagement, 624, top, refined"
244,"yml, create, dependabot, funding, pyyaml, yaml, publish, readthedocs, gitpod, ccpp"
245,"contrast, contrasts, poly, weights, weight, eyes, marshaling, consequence, multiline, trycatch"
246,"jquery, datatables, dom, loads, drop, globally, ensure, darkmode, wordlistinput, datatable"
247,"loganrdj, hover, nav, navbar, effect, gap, sliding, link, links, slide"
248,"dispatch, services, executor, init, ns, alive, client, self, spawn, delay"
249,"bash, shell, tmpl, login, common, dot, logout, misc, env, netrc"
250,"github, actions, codemeta, apk, builds, workflow, remod, cron, tv, fetch"
251,"debug, vendor, cjs, browser, dir, path, destination, module, dist, postbuild"
252,"updating, bom, version, 27ea2, staging, 23ea69, 23ea80, 23ea71, 23ea17, 23ea37"
253,"account, deletion, removal, deleting, cleanup, friend, fcmerrortype, reauth, gorczynski, piotr"
254,"bash, profile, dot, tmpl, bashrc, screenrc, update, term, shell, env"
255,"md, relaunch, todo, shutdown, quick, medatada, architecture, garbage, update, start"
256,"random, nextint, concurrentlist, lock, readlock, concurrentset, head, securerandom, profiler, overhead"
257,"theme, themes, thememanager, swap, fubar, gems, controltheme, default, combo, metro"
258,"splitter, splitters, collapsed, proportion, splitterdock, splitting, orphaned, resizing, splitterpreviewadorner, tablestore"
259,"commit, message, commits, longstring, conventional, blake3, empty, author, authoring, nope"
260,"bigdecimal, atomicinteger, atomiclong, atomicboolean, biginteger, converter, atomic, double, integral, way"
261,"hostwindow, axaml, hostwindowtitlebar, cs, update, , , , , "
262,"login, dashboard, jwiedeman, 1158, 1137, 1010, 1013, referenceerror, login6, 898"
263,"mainwindowviewmodel, cs, webviewsample, csproj, update, , , , , "
264,"markdown, imrpoved, techniques, edits, trick, updates, markup, extensions, point, formula"
265,"readme, create, splash, md, mdbook, asciidoc, jacoco, todo, formatting, instructions"
266,"holiday, advent, hours, calendar, holidays, snowfall, per, teamever, shop, instructions"
267,"jquery, dom, supermarsx, globally, singlewhois, drop, initialization, renderers, renderer, wordlistinput"
268,"performance, replication, tune, tweak, improvements, low, 75m, searched, monir, thefastestresult"
269,"sec, failed, passed, debug, start, debugging, 8queens, debugged, test, codec"
270,"badges, skip, ci, readme, badge, overwrite, downloads, coverage, update, github"
271,"compileintolambda, clang, gcc, compilation, compile, constexpr, 2012, compilethreshold, ub, gentoofying"
272,"index, shopify, recipe, indexes, squarespace, shawarma, chicken, 1000x, manipulate, ourselves"
273,"settings, mod, camelcase, options, rename, collision, name, expansion, additions, choices"
