topic_id,top_words
540,"jorgesanabria, sql, querybuilder, nodes, dialects, query, injection, phpdocs, mysql, snippets"
541,"bladeburner, skill, skills, levels, buy, overclock, cap, level, skillmaxupgradecount, approximation"
542,"zlogin, zlogout, dot, tmpl, empty, rename, discovery, update, path, to"
543,"binary, compatibility, pavlenko, stabilises, yevgen, xcode, enforcer, 21, libx11screensaver, fighting"
544,"selector, commit, triblespace, semantics, nth, range, selectors, parents, citation, backlog"
545,"chore, backend, ignore, electronmon, ds, mute, manual, publish, caches, pr"
546,"datatables, analyser, jquery, supermarsx, rendering, 751, 777, 761, 855, 778"
547,"toolchromecontrol, axaml, update, cs, , , , , , "
548,"referencedataservice, facecatalogservice, parameter, faceservice, cover, recognition, face, invalidation, photoservicegetphotoasynctests, photoserviceuploadtests"
549,"scripts, burn, scriptarg, untabify, reindent, trash, heavy, embedded, defer, developed"
550,"exploit, exploits, tampering, save, prototype, examine, undocumented, edit, unclickable, altering"
551,"parseflags, allocations, parse, register, flags, function, new, compilerutils, src, allocation"
552,"slf4j, org, sentrysoftware, bump, simple, 13, 12, 15, 11, annoying"
553,"uuid, genid, nil, way, rawvalue, rawid, converison, makefuid, ish, biginteger"
554,"ipc, renderer, renderqt, smoke, act, bwa, fetchcompat, interaction, unit, coverage"
555,"jorgesanabria, filters, subquery, dynamic, grouping, filter, clauses, filterop, customfilterbuilder, globalfiltermiddleware"
556,"fcontrasts, ci, artifcle, fcontrast, ctest, cyclic, conan, names, fix, "
557,"md, create, contributing, ageng, review, architecture, instructions, security, some, rename"
558,"stacktrace, stack, trace, traces, hasexceptions, sourcing, monitorprofileanalysermain, purely, inclusion, timestamp"
559,"safepoint, optionalsafepoint, jvm, safepoints, safepointing, pauser, addition, pause, 61, closes"
560,"homepage, messaging, 1080, 1031, 1001, 1138, partner, 963, 910, niche"
561,"pmd, metricshub, warnings, blockmanager, coreextension, ei, warning, spotbugs, rep2, fallthrough"
562,"auction, double, py, sides, multi, rst, docstrings, empty, tutorial, edge"
563,"metadata, dynamic, discovery, trait, forget, attr, rustfmt, traits, files, friendly"
564,"edinsoncs, mempool, pos, joi, validator, webassembly, mine, memorypool, payloads, db"
565,"dev, branch, into, of, merge, , , , , "
566,"dock, md, mvvm, fluent, groups, docking, extensions, content, dockable, wrapper"
567,"e2e, spectron, checklist, chromedriver, adapt, devtools, isolation, runner, migrations, pr"
568,"react, props, prop, hooks, getting, equal, util, composition, fiddling, reactprops"
569,"orval, regenerate, v7, clients, chore, api, 16, regenerated, responsesuccess, responsecomposite"
570,"chronicle, core, release, prepare, 27ea9, 27ea6, 27ea4, 27ea5, 27ea3, 27ea1"
571,"27ea, reverting, back, 26ea, snapshot, bom, version, to, , "
572,"small, minor, another, edit, simple, fix, , , , "
573,"kani, proofs, triblespace, harnesses, harness, unwinding, variableset, guidelines, facade, assumption"
574,"documenttabstripitem, axaml, documenttab, producttab, tpl, trying, offset, cs, warning, update"
575,"workflow, pr, main, delete, review, workflows, trigger, versions, latest, claude"
576,"enum, jdereg, coercion, enumbasiccreationtest, enumwithvaluefield, jointype, deserialization, 383, 389, 388"
577,"vscode, coding, enlist, hugging, devcontainer, nina, recommend, labor, plugins, configuracoes"
578,"minor, small, refinements, education, perfecting, changes, prep, exp, tweak, little"
579,"trader, algorithmic, stock, alg, iii, iv, contracts, stake, solve, sleeps"
580,"acceptance, invitation, clock, down, just, count, first, step, implementation, after"
581,"dbcontext, datacontext, context, design, defaultcontext, materials, smuggling, contextrequirement, pooled, miniature"
582,"fcm, token, login, sync, saving, provider, logins, sendinvitenotification, 799, until"
583,"service, check, py, relay, rbl, traceability, python, function, secret, functions"
584,"openapi, spec, regenerate, chore, addinjectorfactory, restrict, trigger, manual, generation, workflow"
585,"cpus, cool, testing, chroniclesoftware, benchmarks, support, tc, invoke, added, builds"
586,"mainview, axaml, cs, update, , , , , , "
587,"mrme, codesmith, 18, 101, 13, 12, 15, checks, pull, request"
588,"vignette, vignettes, afni, beginning, refinement, overhaul, contrast, more, added, update"
589,"ppf, slope, intercept, joint, bokeh, ppferror, jointppf, infinities, pyplot, slopes"
590,"lints, lint, relax, issues, chore, turn, installation, record, corp, eslint"
591,"documenttabstrip, axaml, update, cs, , , , , , "
592,"dsl, validating, written, validation, libraries, implement, validate, schema, read, confound"
593,"master, merged, merging, relation, 21, builder, changes, improvements, work, implement"
594,"notes, v15, outdated, 16, features, languages, 15, production, version, specifiers"
595,"grind, intelligence, alive, manual, loop, while, travel, running, exiting, cyclical"
596,"union, inc, plenty, pacts, constraint, inclusivity, arc, decouple, tailset, consuming"
597,"labels, area, qt, label, magasins, bloc, centre, recherche, mapnik, text"
598,"resolver, valuetotarget, lives, sealedsupplier, resolvebyname, sanitizemarkdown, resolvers, principalsurdorder, keeps, ensured"
599,"sitemap, regeneration, downloader, regenerated, generation, stuff, articles, generator, addition, routes"
600,"starting, match, matches, start, stuck, inactive, coordinates, shadcn, gc, automatically"
601,"flags, macosx, features, flag, 558, behind, succinctarchive, issues, assert, definition"
602,"csproj, upgrade, latest, chokidar, build, concurrently, sync, directory, cs, system"
603,"comment, comments, mnist, commented, updated, updates, out, update, , "
604,"develop, expression, development, branch, protected, into, 19, of, ci, create"
605,"mask, transformer, maskseq, transformerblock, vectorize, wavelet, babylm, norm, attention, dimension"
606,"png, docktarget, dock, docktargetbase, quality, hand, indicator, visual, cs, asset"
607,"parsing, post, process, detailing, opposed, during, needs, parser, objectresolver, mapresolver"
608,"layoutincludeextension, optimizedsplitlayouttests, optimizedsplitlayoutuitests, cs, webviewsample, create, conditions, delete, package, update"
609,"mdx, accessibility, statement, 1023, 1011, 989, cnil, 780, 776, disappearing"
610,"claim, claims, dated, adhere, userspage, claiming, canseensfw, applicationuser, drop, hook"
611,"rollback, io, json, release, 33, 32, plugin, maven, of, the"
612,"headless, wieslawsoltes, prism, 889, controlrecycling, 794, 789, 787, 589, 578"
613,"serializer, wieslawsoltes, serializers, systemtextjson, protobuf, roundtrip, di, 671, 636, 626"
614,"issue, versioned, oob, eol, wasn, bug, moderation, 187, quick, 67"
615,"documentdock, wieslawsoltes, adddocument, context, 920, defaultcontextlocator, defaulthostwindowlocator, 867, 858, 591"
616,"compiled, bindings, compilebindings, stanfordpl, notepad, sample, support, binding, true, views"
617,"watch, tmp, 315, exists, doesn, directory, lawrwy, createdirectoriesreadonly, one, reindent"
618,"polish, asref, u8, amharic, mongolian, bloblike, ownedid, problems, id, major"
619,"coloring, graph, contracts, proper, two, solver, contract, neighbor, inference, structure"
620,"fonts, dot, otf, fontawesome, awesome, 400, regular, fontconfig, fontfamily, 900"
621,"share, domaine, les, par, onglets, remplace, resilient, service, wiring, fly"
622,"logos, brand, logo, overlay, center, dimensions, specificity, overlays, measured, justification"
623,"pipelines, azure, yml, update, for, , , , , "
624,"cname, webname, delete, create, dns, adding, missing, handle, removed, file"
625,"fcm, implementation, fmrilm, fixes, to, , , , , "
626,"kaggle, hifitime, math, kagi, kramdown, serde, crates, conditional, until, data"
627,"disable, stay, net461, jacoco, dont, temporarily, sticky, force, save, how"
628,"sanitize, parentheses, expression, parens, tuples, caesar, contracts, cipher, shift, degenerate"
629,"knows, 347, interface, everything, marker, implementation, library, ignore, interfaces, mapping"
630,"iterator, iterators, combinator, patch, sized, descending, iterations, nil, owned, hints"
631,"bozelosp, fft, 118, 14, 12, 15, limit, 10, size, bbuchsbaum"
632,"pile, pilereader, corrupt, mmap, corruption, lazily, open, detects, simulation, derive"
633,"role, projectdetailview, views, todos, prefetch, 403, convenience, positions, checkbox, helpdesk"
