topic_id,top_words
274,"unittests, dockmanagertests, csproj, globaldockinginheritancetests, dockdatatemplatehelpertests, dockgroupexecutiontests, globaldockingvalidationtests, dockwindowtests, cs, dock"
275,"groovy, moved, testutil, java, fetchresource, more, converting, converted, junits, securitytest"
276,"cnn, backprop, working, refactors, reworking, layer, cnndata, conv, classes, still"
277,"extract, helpers, cli, export, consolidate, helper, geodata, hook, argparse, prior"
278,"jlbh, stays, latencies, probes, end, 45, throughput, rates, breakdown, xunit"
279,"chronicle, core, release, prepare, plugin, maven, 24ea3, 24ea1, 24ea10, 24ea12"
280,"docktarget, docktoolchrome, axaml, dockabledebugview, dockwindowdebugview, dockadornerwindow, docksimpletheme, update, cs, "
281,"menu, menuview, context, item, close, items, tabs, enablemenuitem, pragma, getsystemmenu"
282,"method, renamed, methods, order, inlined, setnewnumber, lambdas, particular, trivial, misleading"
283,"menuactivity, crash, piotr, gorczynski, buttons, universalloginactivity, universal, dialogs, button, registration"
284,"parent, pom, third, party, java, latest, 24, updating, versions, doclint"
285,"jremillard, unit, coverage, osm, valgrind, metersperpixel, xsd, renderqt, sublayer, breaklines"
286,"pricing, cost, cta, sold, courses, cards, solutions, pour, upsell, hospitality"
287,"tested, pairs, converter, conversions, conversion, charsequence, convertereverythingtest, cross, everything, completed"
288,"wrappers, mocked, collectionhandling, namedmethodfilter, collection, empty, postchecking, isobjectunknown, emerging, checked"
289,"rootdock, rootdockperspectives, rootdockcontrol, rootdockdebug, rootdockdebugextensions, xaml, axaml, pinneddockcontrol, proportionaldockcontrol, cs"
290,"ad, platform, platforms, guides, management, titles, generalize, user, jwiedeman, guidance"
291,"blank, lines, empty, line, reduce, unnecessary, textfile1, e501, vigenere, cut"
292,"folders, folder, rearanged, allowed, files, redirects, reflush, xdg, homedir, dirs"
293,"regressor, evaluate, covariate, glm, regressors, baseline, robust, model, factor, mats"
294,"plotting, plot, consolidate, individual, graph, surplus, mix, chartobooleanfunction, unittest, plots"
295,"firestore, rules, matches, ismatchparticipant, match, access, permissions, invitations, participant, indexes"
296,"app, axaml, cs, appbuilderextensions, update, , , , , "
297,"io, json, release, prepare, plugin, maven, 10, 11, , "
298,"nav, hover, slide, links, style, adjusted, spacing, left, gap, link"
299,"updated, docs, documentation, coming, describe, exports, plot, hooks, 19, 13"
300,"app, axaml, simpledark, simplelight, update, , , , , "
301,"backdoors, backdoor, servers, automation, bitnode, list, mega, tor, corporation, router"
302,"config, mse, maintenance, dmesg, reconfig, polort, unmanaged, responsivity, screenrc, local"
303,"glossary, linking, terminology, marketing, entries, remark, expand, popovers, regex, excessive"
304,"master, sharedkey, branch, into, experiment, isenabled, wasabi, avalonia11, tmp, host"
305,"party, bom, third, 3rd, chronicle, 10, 19, austin, rob, 14"
306,"build, linux, macos, maintain, posix, interactive, quet, tasq, radix, decline"
307,"wip, fp, pat, modernize, ppf, deps, app, cleanup, , "
308,"updated, information, site, added, to, , , , , "
309,"comparator, sumordercomparator, productordercomparator, ne, lessorequal, comparability, greaterorequalthanzero, stateproxycomparator, addmultipleequal, sumtoproductordercomparator"
310,"handlebars, runtime, partials, mainpanel, browser, register, supermarsx, loader, renderer, revert"
311,"net, net461, dotnet, net9, framework, netcoreapp2, target, netstandard2, netcore, sdk"
312,"articles, article, ecom, uneeded, structuring, sentence, refinement, wordpress, cleaning, compliance"
313,"encoding, utf, tostring, utf8, fetched, words, optimise, decoding, strings, 8bit"
314,"ownedid, owner, id, ids, freshid, ownershiop, oom, idowners, symbolic, useable"
315,"xaml, xamlil, format, formatted, avaloniademo, editor, pr, default, app, comment"
316,"sum, sumbalancingtest, fixing, cpp, sumfindmember, sumsurdreduce, sumcopy, repeating, gentoo, sequences"
317,"ad, platform, platforms, guides, management, generalize, user, expand, guidance, fill"
318,"reflectionutils, reflection, getconstructor, reflective, caches, getclassnamefrombytecode, handed, heapy, getclassannotation, caching"
319,"github, neuralegion, kissjoin, codecov, triblesspace, com, openhft, master, branch, token"
320,"exit, async, cancel, commands, fs, wordle, exitcommand, deferred, list2, swithc"
321,"documentcontrol, axaml, documentcontentcontrol, documentdockcontrol, update, cs, , , , "
322,"consent, ads, privacy, ad, policy, checkbox, personalization, canrequestads, preference, consentutils"
323,"typescript, jest, convert, js, supermarsx, ts, modules, linehelper, 898, 699"
324,"pricing, cta, unify, jwiedeman, plan, 399, page, 1027, 1002, 982"
325,"assertequals, assertthat, assertions, assertion, assert, asserts, possible, 221, hunch, teir"
326,"newinstance, simplifying, respecting, developed, capability, exist, parameters, while, objects, being"
327,"fraction, cmp, fractionsimplification, polynomial, sqrt, radicals, exp, ordering, baseint, foxed"
328,"documentcontrol, xaml, document, contentcontrol, icontemplate, usercontrol, getpeercert, isactive, closetemplate, cs"
329,"filter, nofilter, dynamic, fiekds, methodfilter, filternode, customfilterbuilder, submit, callbacks, restoration"
330,"jest, replaces, babel, ts, mocks, esm, configs, mockx, microframework, xmock"
331,"revert, rollback, transitory, conventiosn, shancn, saddle, borrowing, pulled, shadcn, again"
332,"json, io, jsonio, jsonobject, gson, illustrates, nsjson, fined, testemptysubarray, outerlist"
333,"java, util, release, maven, plugin, rollback, prepare, 34, xlint, compile"
334,"clone, copyable, clonehelper, embeddedbytes, trivially, transfer, copy, copying, lockfree, prefare"
335,"sync, real, time, move, syncable, lawrey, peter, itemssource, 435, automatic"
336,"patch, patches, getreturn, patchtriblesetconstraint, bounded, patchingsaid, rework, generators, internals, research"
337,"navbar, nav, active, jwiedeman, highlight, mobile, light, navbar3, navbar4, 901"
338,"main, codex, branch, into, 4oan9b, 3vizbs, 8gckb7, 8r8lm1, 9w1lut, 8vi1k7"
339,"admin, adding, caninstallbackdoor, erased, rights, permission, restrict, superuser, internet, userscontroller"
340,"toml, chezmoi, tmpl, chezmoiexternal, kramdowm, plss, cargo, chezmoiignore, create, diff"
341,"itemdraghelper, master, optimizesplitlayout, branch, into, 7io1sc, dockcontrolcodebehinddatatemplates, dragpinneddockables, dockinggroups, globaldocking"
342,"avalonia, wieslawsoltes, prism, latest, preview, danwalmsley, 548, rc, selection, reactive"
343,"layout, definietion, splitlayout, split, panel, findrootlayout, resetlayout, save, refactored, invalidate"
344,"reverts, revert, commit, this, unrelated, comprehensions, affero, fillpolynomialcoefficients, unlink, webpfile"
345,"awk, awkparser, awksettings, cmd, mimicking, mutators, funstack, exitexception, splits, parenthesis"
346,"netscript, react, definitions, bitburner, umd, karma, shim, lib, undoing, reactdom"
347,"opencl, intel, interop, numenta, serialisation, opengl, kernel, generator, intelsycl, opencluint"
348,"upload, via, files, uploading, filesync, add, updates, allow, json, file"
349,"fe, htoprc, splat, remove, nn, cruft, lombok, removehn, stand, xor"
350,"println, print, removed, statement, wallets, flushed, message, grammar, ors, stdout"
351,"async, unawaited, unneeded, void, corp, await, awaits, mark, operator, office"
352,"postbuild, cake, build, sgandon, script, scripts, declare, powershell, js, updated"
353,"gcd, sum, gcdofmembers, lcm, integer, getcommonvars, gcdtest, issummationsimplifiable, incommonwith, gcdofcoefficients"
354,"artlinkov, aubelsb2, mse, cnn, optimizer, refactors, train, minor, specs, evolution"
355,"demo, sample, app, prism, editor, previewwith, maui, inpc, publish, web"
356,"delta, order, expression, operators, magnitude, bais, struggling, stubs, priorities, sorting"
357,"chezmoiignore, update, , , , , , , , "
358,"social, svg, icons, icon, svgs, commerce, inline, insensitively, msb, sanitizing"
359,"io, json, release, prepare, plugin, maven, 33, 32, 18, 29"
360,"weakreferencecleaner, referencecounter, namedweakref, weak, referencequeue, referencechangelistener, dualreferencecounted, weakreference, history, referencecounted"
361,"yml, frontend, api, generate, update, js, node, keys, pages, shared"
362,"carbon, components, styles, jwiedeman, demo, remnants, header, page, 783, 491"
363,"dockfactory, dockfactorybase, cs, containerawarecommand, dockmvvmsample, dockreactiveuidisample, somes, dockproperties, csproj, samples"
364,"contracts, ii, grid, jumping, unique, runtime, contract, paths, validation, game"
365,"dockcontrolstate, dockmanagerstate, dockdatatemplatehelper, cs, update, state, dock, class, added, "
366,"woodpecker, yml, organize, configs, update, refactor, , , , "
367,"openapi, spec, regenerate, chore, makhin, client, 158, parsequerywithopenai, openai, orval"
368,"principalsurd, principalsurdfactor, iscomesbefore, incommonwith, sum, principlsurd, commonvars, delegating, radicands, scenarios"
369,"person, group, membership, groups, query, dbset, invalidate, projection, key, persongroup"
370,"commit, initial, first, continue, next, refactor, , , , "
371,"tasks, status, pin, chore, ref, mark, robust, complete, maint, triage"
372,"glossary, terminology, linking, jwiedeman, marketing, links, 1077, 1078, 1075, 1076"
373,"dsl, bbuchsbaum, dsl2, implement, bids, builder, 301, validation, 101, validationerrors"
374,"cassandra, medusa, timeouts, normalizing, gevent, list, datacenter, 120s, relaunch, column"
375,"deepequals, diff, breadcrumb, nearing, perfecting, differences, output, formatting, crumb, bread"
376,"cassandra, medusa, jwiedeman, timeouts, 120s, datacenter, hook, 749, 730, 745"
377,"naming, name, fullname, hhib, namespsace, repair, shortnames, sat, reformatting, vouchers"
378,"autocompleting, flags, autocomplete, enable, slate, setconfig, chromium, autofill, importantly, wipe"
379,"crack, attack, hosts, targets, cracking, all, port, crackers, nuked, workers"
380,"spotbugs, metricshub, bump, formatter, deps, github, revelc, org, apache, plugins"
381,"typo, spelling, whoops, aha, oopsy, mispelling, whoopsie, fixed, error, updated"
382,"conflicts, omnn, origin, remote, tracking, src, gradle, properties, branch, cmakelists"
383,"syntax, brackets, phrasing, enquo, benachmarks, oo, quo, scary, semicolon, adjustment"
384,"sum, operator, polynomials, roots, division, polynomial, ispolynomial, unblock, prefere, distincted"
385,"breadcrumbs, breadcrumb, noperson83, companies, styling, location, markup, dashboard, referencing, duplicated"
386,"navigation, navigate, redesign, thisday, nav, refactored, outline, traffic, numbering, foot"
387,"bump, anybytes, version, jerky, enforcer, alpha, binary, reference, number, set"
388,"yml, deploy, publish, maven, attributeid, shorten, sonatype, central, rename, graph"
389,"photobank, standard, host, msw, net, urls, photo, centralize, photos, photowithurls"
390,"tidy, code, inspections, wider, finding, unused, after, core, set, file"
391,"test, sh, just, need, have, search, this, for, to, "
392,"sundry, numerous, gatsby, and, , , , , , "
393,"changelog, md, preservation, permanent, edits, place, reflect, rename, update, note"
394,"vcpkg, 2024, windows, 09, bat, dumpbin, relwithdebinfo, spport, suffixes, ci"
395,"coverage, isnan, chips, cobertura, assertionerror, 544, iscomesbefore, code, happen, additional"
396,"optimizer, isequation, optimizationloopdetect, evolutionary, optimization, optimizations, valuable, product, optimize, highlith"
397,"typo, typos, spelling, misspelling, lookupmisc, prepend, usages, correction, introduction, unavailable"
398,"betas, estimate, estimation, beta, effects, stab, futurize, fracs, stopgap, ols"
399,"afni, stim, censor, times, stims, hrf, trialwise, autin, beginnings, lm"
400,"nugets, nuget, myget, config, packages, net, push, update, small, only"
401,"window, global, windows, documentwindow, createwindow, removewindow, istoolwindow, toolwindows, pane, insertwindow"
402,"unused, old, usings, betresult, purchasedaugs, customervendornumber, played, posts, slots, orphan"
403,"woodpecker, travis, diff, detection, update, fix, , , , "
404,"parsing, skrypt, continuining, digging, expressions, factorial, toward, fixed, kaggle, simple"
405,"hrf, summate, hrfs, empirical, lagged, useunitofwork, lag, smoothing, summation, unitagent"
406,"bytetable, bytebitset, alt, bytetablealt, dynbytes, novel, puts, put, tho, work"
407,"prettier, formatting, light, gray, dark, vignettes, theme, cosmo, 212529, f8f9fa"
408,"dendrites, neurons, statistics, dendrite, neuron, intermediate, synapse, axon, soma, visualization"
409,"queue, wire, encryption, bytes, deltawire, numebr, newintarrayreference, generalise, refactorextract, lightweight"
410,"cmake, commons, msvc, openmind, library, specification, libgen, cmakedependentoption, cmp0141, libjpeg"
411,"arm, mac, conservative, tell, flaky, treat, shorter, give, quicker, slower"
412,"createdocument, adddocument, documentdock, notepad, documentfactory, idocumentdock, addtool, itemssource, idocumentdockcontent, createtool"
413,"changelog, md, updated, ordering, closed, see, many, feature, issues, out"
414,"cleanup, performance, storingtasksqueue, cleanupreadytasks, variability, 597, rm, higher, rationale, programs"
415,"toolcontrol, toolpinnedcontrol, axaml, toolcomparisonview, update, cs, , , , "
416,"contact, page, contact1, info, contactform, formsets, company, department, anchors, deploying"
417,"sleeve, sleeves, study, course, shock, crime, ring, augments, director, synced"
418,"ts, orval, fetcher, tsup, config, resolvers, constants, search, update, renderer"
419,"ipc, handlers, supermarsx, ops, fs, renderer, utils, typed, statsworker, bulk"
420,"filter, makhin, getfilterhash, submit, soft, 728, endless, multiselect, filters, 726"
421,"pnpm, lockfile, preinstall, tv, lock, chore, locking, std, adrianwedd, workflows"
422,"benchmark, importer, throughput, json, import, importers, criterion, blake3, deterministic, bench"
423,"changelog, document, scripts, improvements, bladeburner, eater, sleeve, script, noodle, locations"
424,"gen, genid, flutter, gennum, darwin, rng, ommited, manpager, genetic, plz"
425,"dev, branch, into, of, merge, , , , , "
426,"servers, upgrade, buy, renaming, purchasing, wait, purchased, option, give, upside"
427,"updating, bom, version, 25ea25, 25ea18, 25ea33, 25ea19, 25ea23, 25ea17, 26ea10"
428,"rename, lecture, peter, renamings, accountforcoordinatedomission, accountforcoordinatedommission, pile, notebooks, demo, open"
429,"alpha, bump, version, , , , , , , "
430,"unsafememory, arm, armmemory, copymemory, allocateinstance, offset, unsafe, rationalise, readvolatileshort, readvolatilexxx"
431,"url, openurl, unsplash, uri, getcontentfromurl, openexternal, tagline, tighten, http, broken"
432,"cors, domain, subdomains, subdomain, enable, website, redirection, 459, middleware, redeclaration"
433,"prime, factorization, factor, largest, factors, primes, find, contracts, table, integer"
434,"loading, resource, imagery, optimize, patther, staticresource, brush, loaded, lazy, res"
435,"domain, domains, registry, jwiedeman, reachability, watchlist, dashboard, cert, 485, 696"
436,"gradle, organization, build, findtarget, notes, version, versionname, versioncode, android, androidmanifest"
437,"main, branch, sh, of, dependabot, feature, into, claude, merge, "
438,"timeprovider, settimeprovider, timeproviders, currenttimenanos, switchable, currenttimemicros, monotonically, increasing, implemation, initialnanos"
439,"extrapolator, codec, extrapolation, imagecodec, extrapolated, extrapolate, verticals, test, ubuntu, outline"
440,"histogram, dumping, percentage, high, points, range, precision, longer, histograms, roc"
441,"events, event, deactivated, eventparameters, granular, model, varying, marshalling, livereload, abm"
442,"newlines, redundant, newline, eof, breaks, reduce, line, deduce, pow, asset"
443,"view, viewlocator, getscreenpoint, moveview, staticviewlocator, viewoptimizepause, calculatecostsapiview, findview, headset, di"
444,"avalonia, dock, themes, serializer, csproj, metro, newtonsoft, simple, project, editor"
445,"binding, bindings, bindinghelpers, assignproportionsinternal, mvnlocation, twoway, technically, lists, selection, commands"
446,"move, walls, send, nothing, positions, like, go, don, moved, style"
447,"xaml, mainview, mainwindow, updatechild, twindows, windowclosingeventargs, windowactivationhelper, exit, cs, update"
448,"sodium, stricter, lot, think, lib, ve, types, operational, quite, specifically"
449,"hhh, hh, hhhh, ahue, tanh, meh, ugh, shh, ssh, peter"
450,"leveldb, brew, msvc, linking, preinstalled, initiated, fundationdb, sysstem, getvahost, cachebase"
451,"faq, associations, product, front, reordering, association, pivot, presentation, structured, markup"
452,"env, vars, sqlite, production, infer, load, look, variant, isolate, nuget"
453,"centralizing, testioutilties, urlutilititties, mathutilities, tests, updated, testing, deterministic, clarify, coverage"
454,"doing, efficient, less, making, simplifications, reductions, simplification, more, code, idof"
455,"3rdparty, fann, nexting, furhter, demonstrate, several, beefed, more, smaller, pi"
456,"photos, photo, preview, phototable, thumbnails, list, table, virtualphotolist, split, layouts"
457,"manual, ci, yml, backend, yamllint, autoconfirmation, qa, devin, embedded, pin"
458,"hostwindow, xaml, layoutupdated, update, host, event, window, handle, for, "
459,"photolistitemmobile, virtualphotolist, getallphotos, photodetail, virtualitem, findallbytestid, photocreatedhandler, getallphotosasync, photo, fixture"
460,"archive, tribleset, constraint, trible, trait, triblearchive, triblesetconstraint, work, reified, universe"
461,"v2, 20, consolidation, anticipation, far, preparing, 19, else, thus, nothing"
462,"mainwindow, axaml, resetwindowlayoutwindow, cs, update, , , , , "
463,"github, triblespace, com, main, branch, of, tribleset, master, merge, "
464,"userguide, guide, relieving, anxiety, refocus, digital, deepequals, user, updated, traverser"
465,"lvl, up, lvlup, term, everblock, down, , , , "
466,"train, mnist, training, rprop, mse, ptrmatrix, dosn, sgd, rcpp, cnn"
467,"worker, rightsem, whois, newest, domains, deduplicating, domain, 593, workers, dedupe"
468,"ea, develop, feature, experiment, branch, nobitset, denser, branch2, sharing, succinctarchive"
469,"info, version, redist, signup, salt, updated, releases, patches, nuke, 257"
470,"proportionalstackpanel, proportionalstackpanelsplitter, children, isempty, iscollapsed, proportionalstackpaneldemo, measures, proportional, proportion, cs"
471,"mainwindowviewmodel, cs, update, , , , , , , "
472,"idockservice, interface, idock, idockstate, idockmanager, idockablecontrol, idocumenttemplate, imtribledb, itab, inavigateadapter"
473,"delete, documentdocktests, tooldocktests, cs, layoutdocktests, rootdocktests, dockbasetests, hostwindowbasetests, documenttabtests, emptydockfactory"
474,"resultiterator, php, samples, sample, cake, 1000, leads, select, notebook, crud"
475,"repo, others, gitkeep, bitbucket, single, copyright, rs, work, repository, tidy"
476,"frontend, resolve, build, portfolio, errors, issues, mismatches, serve, shared, artifacts"
477,"nettests, pipeline, define, runner, rmsync, wiredfile, getuserdatapath, generatefilename, demonstrating, network"
478,"osgi, classloader, cedarsoftware, geom, jpms, loader, getclassloader, exports, awt, com"
479,"updates, various, random, install, refresh, update, , , , "
480,"photo, feat, caches, photos, persist, filter, ingestion, row, lightbox, dexie"
481,"quote, quotesviewmodel, view, rebate, quotetochange, creation, frmcreatequote, addpartviewmodel, quoteswift, bindings"
482,"constraints, constraint, intersectionconstraint, clamp, intersection, constainment, succinctarchiveconstraint, whopping, constrains, variable"
483,"placeholder, page, consulting, destinations, website, replace, services, emails, navigation, membership"
484,"packaging, jobs, hello, subpackages, packages, world, dist, package, organize, reports"
485,"invite, translations, spanish, friend, invitation, strings, notes, translation, french, blocking"
486,"waybar, arran4, pager, cyberpunk, tooltip, sink, swaymsg, audio, sysinfo, switcher"
487,"network, vanilla, cr, layer, reworked, walking, linear, layers, hidden, layer2layer"
488,"release, prepare, plugin, maven, brought, needs, keep, help, additional, tools"
489,"tweaks, doc, interesting, patterns, hour, remember, things, rule, document, pattern"
490,"favicon, favicons, branding, rotation, animated, links, emoji, animation, device, head"
491,"contrast, bbuchsbaum, voxelwise, voxel, contrasts, qr, chunked, parallel, 04r, ticket"
492,"drop, getpricesdrop, refactored, handler, constraints, forceinline, topmost, floating, documents, behavior"
493,"files, outdated, checked, useless, backup, deleted, 102550, 20250814, unimportant, slow"
494,"build, buildproblem, yarn, pulls, printout, transferred, certstream, regexp, capturing, script"
495,"lrucache, threaded, insidious, usually, unless, locking, compared, enough, was, little"
496,"formatted, format, standard, reformatted, code, formatting, idea, rest, pr, definition"
497,"shutdown, referencecleanerexecutor, longshorej, sighup, hook, cleanly, replication, unregistring, thanks, controlled"
498,"demofactory, demoxaml, demodockfactory, csproj, demodebug, cs, demo, refactored, update, factory"
499,"schema, frog, blue, keyspace, database, 1152, 1173, jwiedeman, 753, 751"
500,"toolpinitemcontrol, fluent, axaml, toolcrossnavigationview, toolcontentcontrol, fluentthememanager, tooldocumentpreviewview, default, update, cs"
501,"updating, bom, version, latest, third, party, versions, pom, to, the"
502,"plugins, org, apache, sentrysoftware, surefire, bump, maven, 12, 00, skin"
503,"duplicate, entry, launc, getlastquote, dup, registrantorganization, symantic, univariate, getrelations, creationdate"
504,"whitening, ar, whiten, prewhitening, runwise, voxelwise, inplace, openmp, whitespcae, lm"
505,"chronicle, core, release, prepare, plugin, 25ea7, 25ea2, 25ea5, 25ea13, 25ea10"
506,"i18n, baseactivity, locale, language, translator, navigator, bot, feat, bridge, detector"
507,"faq, association, teamever, structured, product, front, reordering, faqs, pivot, 474"
508,"feature, master, movefactoryproperty, editorpropertiesrefactoring, branch, into, readoptions, merge, , "
509,"packages, packets, npm, healthcheck, serilog, plugins, versions, updated, product, updates"
510,"fastreader, fastbytearrayinputstream, fastpushbackreader, fastbytearrayoutputstream, fastwriter, synchronization, bytearrayinputstream, bytearrayoutputstream, synchronized, flush"
511,"stringutilities, getbytes, createstring, stringutils, stringbuilder, isempty, stringutilties, wildcardtoregexpattern, undid, stringinterner"
512,"windows, calibration, do, full, pc, mentioned, appium, micro, 425, stable"
513,"cfals, bbuchsbaum, wrapper, design, fmrilm, implement, projection, fmrireg, bars, 02"
514,"msvc, clgl, macfix, distibution, autoenable, vimpager, msvcfix, nsis, pch, opengl"
515,"dark, mode, dashboard, persist, selectable, forced, nav, toggle, leaving, active"
516,"travis, shading, ci, until, commented, looked, liner, maputil, mavan, openjdk6"
517,"space, whitespace, trailing, trimspace, colon, separator, suppression, spaces, cannot, comma"
518,"array, arrayutilities, partitioning, longarraydirectreference, uncompress, arrays, assoc, materializing, gsub, arraydeque"
519,"compression, compressed, gzip, adjustablegzipoutputstream, corrupted, fastbytearrayoutputstream, ce, js, 187, adjustablefastgzipoutputstream"
520,"25ea, reverting, back, snapshot, bom, version, to, , , "
521,"badge, appveyor, gitter, svg, badges, marketing, intellij, logo, travis, new"
522,"date, filter, dates, filters, day, sadashiva108, makhin, formatdate, datetimepicker, pickers"
523,"dockstate, dockserializer, cs, injection, update, dependency, dock, create, md, use"
524,"middleware, odata, activerecord, linq, middlewares, example, graphql, crud, helpers, docs"
525,"mjs, qa, vitest, pin, bus, task, investigate, inbox, classify, resolution"
526,"edinsoncs, tailwind, dashboard, theme, loaders, toggle, bydchain, skeleton, ui, animate"
527,"quote, codesmith, mrme, syncfusion, applicationdata, dlls, observableobject, view, selections, viewing"
528,"subproject, secrets, reference, commit, submodule, chore, latest, proper, update, in"
529,"toolcontrol, xaml, toolpinitemcontrol, headertemplate, flyouts, icontemplate, modifiedtemplate, menus, setters, toolpinnedcontrol"
530,"controllers, admin, teamever, tab, redirect, configuration, admineverblock, 481, csrf, tabbed"
531,"annotations, annotate, intellij, notnull, chroniclefeature, annotation, lifetimes, lawrey, peter, 412"
532,"reactiveui, sample, reactive, routing, wieslawsoltes, di, obselete, reactivegenerator, 790, reactiveproperty"
533,"medusa, columns, recon, enumerate, planned, unified, csv, expand, extra, note"
534,"fraction, modulo, optimize, optimization, ohhmm, numerator, pfx, duo, exponentiation, balancing"
535,"jekyll, theme, gh, cayman, liquid, minimal, killer, scared, pages, pls"
536,"hash, crypto, hashing, hasher, sha1, perceptual, imagemagick, packing, fingerprint, computation"
537,"readme, recon, prestashop, scan, compatibility, update, updates, module, and, for"
538,"footer, bottom, dashboard, sticks, nav, promotions, sticky, duplicated, redesign, integrations"
539,"cleanups, minor, clean, cruft, modifiers, nlc, ups, here, cleanup, small"
